{"$defs":{"expect-generator-check":{"additionalProperties":false,"properties":{"kind":{"const":"generator-check"}},"required":["kind"],"type":"object"},"expect-result":{"additionalProperties":false,"properties":{"absent_marker":{"$ref":"#/$defs/text"},"blake3":{"$ref":"#/$defs/hex32"},"kind":{"const":"result"},"pins":{"items":{"additionalProperties":false,"properties":{"exact":{"pattern":"^-?[0-9]+/[1-9][0-9]*$","type":"string"},"field":{"enum":["brier_micros","crps_micros","ece_micros","population_avg_brier_micros","lift_vs_population_avg_micros","persistence_brier_micros","lift_vs_persistence_micros","personal_base_rate_brier_micros","lift_vs_personal_base_rate_micros"]},"rounded":{"type":"integer"},"without_floor":{"type":"integer"}},"required":["field","exact","rounded"],"type":"object"},"minItems":1,"type":"array"},"record":{"enum":["MTR1","MQR1"]}},"required":["kind","record","blake3"],"type":"object"},"hex32":{"pattern":"^[0-9a-f]{64}$","type":"string"},"member":{"additionalProperties":false,"properties":{"blake3":{"$ref":"#/$defs/hex32"},"bytes":{"maximum":67108864,"minimum":1,"type":"integer"},"record":{"enum":["MTI1","MTQ1","MTR1"]}},"required":["record","blake3","bytes"],"type":"object"},"stimulus-generator-check":{"additionalProperties":false,"properties":{"command":{"const":"python3 scripts/generate_metric_conformance_fixtures.py --check"},"kind":{"const":"generator-check"}},"required":["kind","command"],"type":"object"},"stimulus-recompute":{"additionalProperties":false,"properties":{"families":{"items":{"enum":["positive","denied","malformed","resource-exhaustion","deletion-redaction","downgrade","independent-evaluation"]},"minItems":1,"type":"array"},"kind":{"const":"recompute"}},"required":["kind","families"],"type":"object"},"subcase":{"additionalProperties":false,"properties":{"expect":{"oneOf":[{"$ref":"#/$defs/expect-result"},{"$ref":"#/$defs/expect-generator-check"}]},"id":{"pattern":"^ind\\.[0-9]+[a-z]?$","type":"string"},"member":{"oneOf":[{"$ref":"#/$defs/member"},{"type":"null"}]},"stimulus":{"oneOf":[{"$ref":"#/$defs/stimulus-recompute"},{"$ref":"#/$defs/stimulus-generator-check"}]},"title":{"$ref":"#/$defs/text"}},"required":["id","title","member","expect"],"type":"object"},"text":{"pattern":"^[ -~]*$","type":"string"},"u64":{"maximum":9007199254740991,"minimum":0,"type":"integer"}},"$id":"urn:pigloros:metric-conformance:case:v2:independent-evaluation","$schema":"https://json-schema.org/draft/2020-12/schema","additionalProperties":false,"properties":{"algorithm":{"additionalProperties":false,"properties":{"id":{"const":"pigloros.metric.binary-calibration"},"major":{"const":1}},"required":["id","major"],"type":"object"},"family":{"const":"independent-evaluation"},"schema":{"const":"pigloros.metric-conformance.case.v2"},"subcases":{"items":{"$ref":"#/$defs/subcase"},"maxItems":64,"minItems":1,"type":"array"}},"required":["schema","family","algorithm","subcases"],"title":"Metric conformance case payload, family independent-evaluation","type":"object"}
