{"algorithm":{"id":"pigloros.metric.binary-calibration","major":1},"family":"independent-evaluation","schema":"pigloros.metric-conformance.case.v2","subcases":[{"expect":{"blake3":"fb139aa8aec181c1157ad8f3f7b8f0cda79ae32bae6ab70131ca4a34872d4fc5","kind":"result","record":"MTR1"},"id":"ind.1","member":{"blake3":"91a3121ca0a724b9b1b6ede7138aa1c9270fbe229c96740645fd71f4109c3997","bytes":686,"record":"MTI1"},"stimulus":{"families":["positive","deletion-redaction"],"kind":"recompute"},"title":"pos-reference recomputes this MTI1 and every positive and deletion-redaction oracle"},{"expect":{"kind":"generator-check"},"id":"ind.2","member":null,"stimulus":{"command":"python3 scripts/generate_metric_conformance_fixtures.py --check","kind":"generator-check"},"title":"the generator --check reproduces every oracle with exact fractions"},{"expect":{"blake3":"ece164fd56b198a14fcb3f6af2a28e2bff419d468d77818bf35c6f422e11957b","kind":"result","record":"MQR1"},"id":"ind.3","member":{"blake3":"c0d962f5f9149c59c63ebf9f2dae4b56da8e74a94d3277d66766e63baa4b3fb8","bytes":218,"record":"MTQ1"},"title":"pos-reference recomputes the MTQ1 vectors from bit patterns"}]}
